{
  "id": "19c33d10-99d2-11ea-bb37-0242ac130002",
  "name": "Default job profile",
  "destination": "fileSystem",
  "description": "Default job profile",
  "userInfo": {
    "firstName": "System",
    "lastName": "Process",
    "userName": "system_process"
  },
  "mappingProfileId": "25d81cbe-9686-11ea-bb37-0242ac130002",
  "metadata": {
    "createdDate": "2019-07-22T11:22:07Z",
    "updatedDate": "2019-07-27T13:28:54Z"
  }
}
